[
    {
        "id": "H-001",
        "trace_type": "happy_path",
        "category": "factual_accuracy",
        "domain": "economics",
        "difficulty": "easy",
        "input": {
            "topic": "BRICS De-dollarization and the Shift Away from USD Dominance",
            "pre_context": {
                "raw_text": "The BRICS nations (Brazil, Russia, India, China, and South Africa) have been gradually reducing their reliance on the US dollar in international trade. In 2023, the BRICS bloc accounted for approximately 36% of global GDP in purchasing power parity terms, surpassing the G7's 30%. China and Brazil signed an agreement in early 2023 to settle trade in their respective currencies, bypassing the dollar. Russia's trade with China is now over 80% settled in rubles and yuan, up from roughly 25% before 2022 sanctions. India has been purchasing Russian oil in rupees and dirhams. The New Development Bank (NDB), established by BRICS in 2014 with $100 billion in authorized capital, provides an alternative to IMF and World Bank lending. In August 2023, BRICS expanded to include Egypt, Ethiopia, Iran, Saudi Arabia, and the United Arab Emirates. Despite these developments, the US dollar still dominates approximately 88% of international forex transactions and represents about 58% of global foreign exchange reserves as of Q3 2023, according to IMF COFER data.",
                "source_urls": [
                    "https://www.imf.org/external/datamapper/COFER",
                    "https://www.bis.org/statistics/rpfx22.htm"
                ],
                "target_audience": "General",
                "guardrail_strictness": "High"
            },
            "strict_compliance_mode": true
        },
        "trace_spec": {
            "expected_state_sequence": [
                "PENDING",
                "RESEARCHING",
                "FACT_CHECKING_RESEARCH",
                "SCRIPTING",
                "FACT_CHECKING_SCRIPT"
            ],
            "expected_agent_calls": [
                {
                    "state": "RESEARCHING",
                    "agent": "ResearchAgent",
                    "reason": "Enrich raw context with web search and deep analysis",
                    "expected_verdict": "SUCCESS"
                },
                {
                    "state": "SCRIPTING",
                    "agent": "CopywriterAgent",
                    "reason": "Draft script from approved research",
                    "expected_verdict": "SUCCESS"
                },
                {
                    "state": "FACT_CHECKING_SCRIPT",
                    "agent": "RedTeamAgent",
                    "reason": "Audit script claims against evidence",
                    "expected_verdict": "SUCCESS"
                }
            ],
            "expected_tool_calls": [
                {
                    "agent": "orchestrator",
                    "tool": "tavily_search",
                    "args": {
                        "query": "BRICS de-dollarization 2023 2024 trade currency shift"
                    },
                    "per_claim": false
                },
                {
                    "agent": "ResearchAgent",
                    "tool": "semantic_search",
                    "args": {
                        "query": "BRICS currency trade settlement dollar alternative"
                    },
                    "per_claim": false
                },
                {
                    "agent": "RedTeamAgent",
                    "tool": "semantic_search",
                    "args": {"query": "dollar share global forex reserves 2023"},
                    "per_claim": true
                }
            ],
            "expected_feedback_history": [],
            "fallback_expectations": [],
            "rejection_expectations": [],
            "note": "Standard happy path — research enriches, copywriter drafts, red team approves"
        },
        "expected_outcomes": {
            "research": {
                "must_include_facts": [
                    "BRICS accounts for approximately 36% of global GDP (PPP)",
                    "US dollar represents about 58% of global forex reserves",
                    "China-Brazil trade agreement in 2023 settled in local currencies"
                ],
                "must_avoid": [
                    "Claiming the dollar has lost reserve currency status",
                    "Stating BRICS has replaced the dollar entirely"
                ],
                "min_chunks": 3,
                "min_confidence": 0.8,
                "refined_context_word_range": [800, 1500]
            },
            "script": {
                "must_include_topics": [
                    "BRICS currency agreements",
                    "dollar reserve dominance",
                    "New Development Bank"
                ],
                "must_avoid": ["Sensationalist claims about dollar collapse"],
                "scene_count_range": [3, 6],
                "word_count_range": [150, 450],
                "must_have_hook": true,
                "must_have_loop": true,
                "storyboard_fields": ["visual_prompt", "audio_cue"]
            },
            "fact_check": {
                "expected_overall_verdict": "SUPPORTED",
                "max_unsupported_claims": 0,
                "claims_with_known_verdicts": [
                    {
                        "claim_text": "BRICS accounted for approximately 36% of global GDP in PPP terms",
                        "expected_verdict": "SUPPORTED"
                    },
                    {
                        "claim_text": "The US dollar represents about 58% of global foreign exchange reserves",
                        "expected_verdict": "SUPPORTED"
                    },
                    {
                        "claim_text": "China and Brazil signed an agreement to settle trade in local currencies in 2023",
                        "expected_verdict": "SUPPORTED"
                    }
                ],
                "min_claim_count": 3,
                "evidence_must_have_references": true
            },
            "optimization": null,
            "final_status": "FACT_CHECKING_SCRIPT (approved)",
            "assertions": []
        },
        "scoring": {
            "rubric_set": "fact_check",
            "pass_threshold": 0.85,
            "dimension_thresholds": {"accuracy": 0.9, "evidence_quality": 0.8}
        },
        "metadata": {
            "created_by": "system",
            "notes": "Baseline happy path — clean facts, no ambiguity",
            "tags": ["happy_path", "economics", "de-dollarization", "factual_accuracy"]
        }
    },
    {
        "id": "H-002",
        "trace_type": "happy_path",
        "category": "factual_accuracy",
        "domain": "technology",
        "difficulty": "easy",
        "input": {
            "topic": "EU AI Act: Risk-Based Regulation of Artificial Intelligence",
            "pre_context": {
                "raw_text": "The European Union AI Act (Regulation 2024/1689) was adopted by the European Parliament on 13 March 2024 and entered into force on 1 August 2024. It is the world's first comprehensive legal framework for artificial intelligence. The regulation establishes a risk-based classification system with four tiers. Unacceptable risk applications are banned outright, including social scoring by governments, real-time remote biometric identification in public spaces (with narrow law enforcement exceptions), and manipulative AI that exploits vulnerabilities. High-risk AI systems — such as those used in critical infrastructure, education, employment, law enforcement, and migration — must comply with strict requirements including risk management systems, data governance, technical documentation, human oversight, and accuracy standards. Limited-risk systems like chatbots must meet transparency obligations: users must be informed they are interacting with AI. Minimal-risk systems (spam filters, video games) face no additional requirements. The Act also introduces specific rules for general-purpose AI (GPAI) models, with additional obligations for models deemed to pose systemic risk, defined as those trained using more than 10^25 FLOPs. Penalties for non-compliance can reach up to 35 million euros or 7% of global annual turnover, whichever is higher. Implementation is phased, with most obligations applying from 2 August 2025 onward.",
                "source_urls": [
                    "https://artificialintelligenceact.eu/",
                    "https://eur-lex.europa.eu/legal-content/EN/TXT/?uri=CELEX%3A32024R1689"
                ],
                "target_audience": "General",
                "guardrail_strictness": "High"
            },
            "strict_compliance_mode": true
        },
        "trace_spec": {
            "expected_state_sequence": [
                "PENDING",
                "RESEARCHING",
                "FACT_CHECKING_RESEARCH",
                "SCRIPTING",
                "FACT_CHECKING_SCRIPT"
            ],
            "expected_agent_calls": [
                {
                    "state": "RESEARCHING",
                    "agent": "ResearchAgent",
                    "reason": "Enrich with latest EU AI Act implementation details",
                    "expected_verdict": "SUCCESS"
                },
                {
                    "state": "SCRIPTING",
                    "agent": "CopywriterAgent",
                    "reason": "Draft explanatory script about the regulation",
                    "expected_verdict": "SUCCESS"
                },
                {
                    "state": "FACT_CHECKING_SCRIPT",
                    "agent": "RedTeamAgent",
                    "reason": "Verify regulatory details and article references",
                    "expected_verdict": "SUCCESS"
                }
            ],
            "expected_tool_calls": [